{
  "schemaVersion": 1,
  "animationId": "course-g05-l04-in-009",
  "inventoryStatus": "static-exhaustive-runtime-unverified",
  "migrationStatusChanged": false,
  "authorityStatement": [
    "This inventory exhaustively indexes the currently exported AVM1 scripts, swfmill timeline/definition structure, migration/readiness records, and active lesson XML.",
    "Static evidence does not prove Adobe-runtime reachability, original host defaults, audio timing, or visual fidelity; unresolved items remain explicit.",
    "No legacy network, JavaScript bridge, persistent storage, host command, or remote load was executed while generating this file.",
    "The selected animation ID and workspace source identity are hash-bound to an exact atomic lesson-release member; that membership authorizes only this static audit output."
  ],
  "source": {
    "swf": "source-assets/flash/HELP MATH_ORIGINAL FILES/HELP_COURSES/ELMGR5/L4/IN/L4IN09.swf",
    "swfSha256": "5445a53852cec9ee7723e6058d3d7338a4c8a3fcf62b3575f5957de2b8c8e533",
    "fla": "source-assets/flash/HELP MATH_ORIGINAL FILES/HELP_COURSES/ELMGR5/L4/IN/L4IN09.fla",
    "flaSha256": "c6d1c3c10fa69522a7bd01b462c01ab44c85ee956cc38d7ba3cb03de2be561fb",
    "pairedFlaStatus": "present",
    "stage": {
      "width": 800,
      "height": 600
    },
    "fps": 12,
    "rootFrameCount": 10,
    "actionScriptVersion": "AS1/2"
  },
  "courseXml": {
    "artifact": {
      "artifactId": "course-xml",
      "path": "source-assets/flash/HELP MATH_ORIGINAL FILES/HELP_COURSES/ELMGR5/L4/index.xml",
      "sha256": "b6f1718da8f5e909cb96c883902009887eb965d41e41588318b4bfb36c8f7a36"
    },
    "parseMethod": "Python xml.etree.ElementTree after in-memory bare-ampersand repair",
    "parserSha256": "fe4f0f7a119819edf1b62a1bf114c339619f689789e812ea41b529e45e0c97da",
    "bareAmpersandRepairs": 0,
    "lesson": {
      "courseName": "Counting on Numbers",
      "lessonName": "Number Lines",
      "lessonNumber": "4",
      "pageRoot": "HELP_COURSES/ELMGR5/L4",
      "title": "Number Lines"
    },
    "sections": [
      {
        "attributes": {
          "SName": "IR",
          "SNumber": "1",
          "SSplit": "",
          "SecButtonLocX": "-2000",
          "SecButtonLocY": "-2000",
          "StartButtonX": "",
          "StartButtonY": "",
          "SubTitle": "NO"
        },
        "name": "IR",
        "pages": [
          {
            "attributes": {
              "BGText": "Yes",
              "RandomAudio": "Yes",
              "Title": "Introduction"
            },
            "path": "IR/L4RW01.swf",
            "evidence": {
              "artifactId": "course-xml",
              "line": 25
            }
          }
        ],
        "subpages": [],
        "titles": {
          "english": "Introduction",
          "spanish": "Introduction"
        }
      },
      {
        "attributes": {
          "SName": "RW",
          "SNumber": "2",
          "SSplit": "",
          "SecButtonLocX": "-155.05",
          "SecButtonLocY": "-278.25",
          "StartButtonX": "",
          "StartButtonY": "",
          "SubTitle": "NO"
        },
        "name": "RW",
        "pages": [
          {
            "attributes": {
              "BGText": "",
              "RandomAudio": "",
              "Title": "Page 1"
            },
            "path": "RW/L4RW02.swf",
            "evidence": {
              "artifactId": "course-xml",
              "line": 34
            }
          },
          {
            "attributes": {
              "BGText": "",
              "RandomAudio": "",
              "Title": "Page 2"
            },
            "path": "RW/L4RW03.swf",
            "evidence": {
              "artifactId": "course-xml",
              "line": 35
            }
          },
          {
            "attributes": {
              "BGText": "",
              "RandomAudio": "",
              "Title": "Page 3"
            },
            "path": "RW/L4RW04.swf",
            "evidence": {
              "artifactId": "course-xml",
              "line": 36
            }
          }
        ],
        "subpages": [],
        "titles": {
          "english": "Your World",
          "spanish": "Tu mundo"
        }
      },
      {
        "attributes": {
          "SName": "VB",
          "SNumber": "3",
          "SSplit": "",
          "SecButtonLocX": "-155.05",
          "SecButtonLocY": "-238.8",
          "StartButtonX": "-30.1",
          "StartButtonY": "-238.45",
          "SubTitle": "YES"
        },
        "name": "VB",
        "pages": [
          {
            "attributes": {
              "BGText": "",
              "RandomAudio": "",
              "Title": "Numbers on a Number Line"
            },
            "path": "VB/L4VB02.swf",
            "evidence": {
              "artifactId": "course-xml",
              "line": 45
            }
          },
          {
            "attributes": {
              "BGText": "",
              "RandomAudio": "",
              "Title": "Number Line Practice"
            },
            "path": "VB/L4VB03.swf",
            "evidence": {
              "artifactId": "course-xml",
              "line": 46
            }
          },
          {
            "attributes": {
              "BGText": "",
              "RandomAudio": "",
              "Title": "Integers"
            },
            "path": "VB/L4VB04.swf",
            "evidence": {
              "artifactId": "course-xml",
              "line": 47
            }
          },
          {
            "attributes": {
              "BGText": "",
              "RandomAudio": "",
              "Title": "Zero"
            },
            "path": "VB/L4VB05.swf",
            "evidence": {
              "artifactId": "course-xml",
              "line": 48
            }
          },
          {
            "attributes": {
              "BGText": "",
              "RandomAudio": "",
              "Title": "Opposites"
            },
            "path": "VB/L4VB06.swf",
            "evidence": {
              "artifactId": "course-xml",
              "line": 49
            }
          },
          {
            "attributes": {
              "BGText": "",
              "RandomAudio": "",
              "Title": "Opposites"
            },
            "path": "VB/L4VB07.swf",
            "evidence": {
              "artifactId": "course-xml",
              "line": 50
            }
          },
          {
            "attributes": {
              "BGText": "",
              "RandomAudio": "",
              "Title": "Positive Integers"
            },
            "path": "VB/L4VB08.swf",
            "evidence": {
              "artifactId": "course-xml",
              "line": 51
            }
          },
          {
            "attributes": {
              "BGText": "",
              "RandomAudio": "",
              "Title": "Negative Integers"
            },
            "path": "VB/L4VB09.swf",
            "evidence": {
              "artifactId": "course-xml",
              "line": 52
            }
          },
          {
            "attributes": {
              "BGText": "",
              "RandomAudio": "",
              "Title": "Integers Practice"
            },
            "path": "VB/L4VB10.swf",
            "evidence": {
              "artifactId": "course-xml",
              "line": 53
            }
          },
          {
            "attributes": {
              "BGText": "",
              "RandomAudio": "",
              "Title": "Integers Practice"
            },
            "path": "VB/L4VB11.swf",
            "evidence": {
              "artifactId": "course-xml",
              "line": 54
            }
          }
        ],
        "subpages": [
          {
            "attributes": {
              "EngSubTitleName": "1. Numbers on a Number Line",
              "SpanSubTitleName": "Números en la recta numérica",
              "SubTitleButtonName": "L4VB02"
            },
            "path": "VB/L4VB02.swf",
            "evidence": {
              "artifactId": "course-xml",
              "line": 56
            }
          },
          {
            "attributes": {
              "EngSubTitleName": "2. Number Line Practice",
              "SpanSubTitleName": "Práctica de números en la recta numérica",
              "SubTitleButtonName": "L4VB03"
            },
            "path": "VB/L4VB03.swf",
            "evidence": {
              "artifactId": "course-xml",
              "line": 57
            }
          },
          {
            "attributes": {
              "EngSubTitleName": "3. Integers",
              "SpanSubTitleName": "Enteros",
              "SubTitleButtonName": "L4VB04"
            },
            "path": "VB/L4VB04.swf",
            "evidence": {
              "artifactId": "course-xml",
              "line": 58
            }
          },
          {
            "attributes": {
              "EngSubTitleName": "4. Zero",
              "SpanSubTitleName": "Cero",
              "SubTitleButtonName": "L4VB05"
            },
            "path": "VB/L4VB05.swf",
            "evidence": {
              "artifactId": "course-xml",
              "line": 59
            }
          },
          {
            "attributes": {
              "EngSubTitleName": "5. Opposites",
              "SpanSubTitleName": "Opuestos",
              "SubTitleButtonName": "L4VB06"
            },
            "path": "VB/L4VB06.swf",
            "evidence": {
              "artifactId": "course-xml",
              "line": 60
            }
          },
          {
            "attributes": {
              "EngSubTitleName": "6. Positive Integers",
              "SpanSubTitleName": "Enteros positivos",
              "SubTitleButtonName": "L4VB08"
            },
            "path": "VB/L4VB08.swf",
            "evidence": {
              "artifactId": "course-xml",
              "line": 61
            }
          },
          {
            "attributes": {